{
  "$schema": "https://json-schema.org/draft/2020-12/schema",
  "$id": "https://schemas.lexmount.net/abyss/broker-plugin/v2/agent-event.schema.json",
  "title": "Abyss broker plugin protocol version 2 AgentEvent",
  "type": "object",
  "additionalProperties": false,
  "required": [
    "event_id",
    "occurred_at",
    "device",
    "agent",
    "session_id",
    "turn_index",
    "llm",
    "side",
    "token_usage"
  ],
  "properties": {
    "event_id": {
      "type": "string"
    },
    "occurred_at": {
      "type": "string",
      "format": "date-time"
    },
    "device": {
      "$ref": "#/$defs/deviceContext"
    },
    "agent": {
      "$ref": "#/$defs/agentContext"
    },
    "session_id": {
      "type": "string"
    },
    "turn_index": {
      "type": "integer",
      "minimum": 1,
      "maximum": 4294967295
    },
    "turn_id": {
      "type": "string"
    },
    "llm": {
      "$ref": "#/$defs/llmContext"
    },
    "side": {
      "enum": [
        "request",
        "response"
      ]
    },
    "text": {
      "type": "string"
    },
    "token_usage": {
      "$ref": "#/$defs/tokenUsage"
    },
    "tool_calls": {
      "type": "array",
      "items": {
        "$ref": "#/$defs/toolCall"
      }
    },
    "tool_results": {
      "type": "array",
      "items": {
        "$ref": "#/$defs/toolResult"
      }
    },
    "attachments": {
      "type": "array",
      "items": {
        "$ref": "#/$defs/imageAttachment"
      }
    },
    "raw_body": {
      "$ref": "#/$defs/rawBody"
    }
  },
  "$defs": {
    "deviceContext": {
      "type": "object",
      "additionalProperties": false,
      "required": [
        "host_name",
        "platform"
      ],
      "properties": {
        "host_name": {
          "type": "string"
        },
        "platform": {
          "type": "string"
        },
        "os_version": {
          "type": "string"
        }
      }
    },
    "agentContext": {
      "type": "object",
      "additionalProperties": false,
      "required": [
        "name"
      ],
      "properties": {
        "name": {
          "type": "string"
        },
        "version": {
          "type": "string"
        }
      }
    },
    "llmContext": {
      "type": "object",
      "additionalProperties": false,
      "required": [
        "provider",
        "model"
      ],
      "properties": {
        "provider": {
          "type": "string"
        },
        "model": {
          "type": "string"
        }
      }
    },
    "tokenUsage": {
      "type": "object",
      "additionalProperties": false,
      "required": [
        "input_tokens",
        "output_tokens",
        "cache_read_tokens",
        "cache_write_tokens",
        "reasoning_tokens",
        "total_tokens"
      ],
      "properties": {
        "input_tokens": {
          "type": "integer",
          "minimum": 0
        },
        "output_tokens": {
          "type": "integer",
          "minimum": 0
        },
        "cache_read_tokens": {
          "type": "integer",
          "minimum": 0
        },
        "cache_write_tokens": {
          "type": "integer",
          "minimum": 0
        },
        "reasoning_tokens": {
          "type": "integer",
          "minimum": 0
        },
        "total_tokens": {
          "type": "integer",
          "minimum": 0
        }
      }
    },
    "toolCall": {
      "type": "object",
      "additionalProperties": false,
      "required": [
        "call_id",
        "name",
        "input",
        "input_sha256"
      ],
      "properties": {
        "call_id": {
          "type": "string"
        },
        "name": {
          "type": "string"
        },
        "input": {
          "type": "string"
        },
        "input_sha256": {
          "type": "string"
        }
      }
    },
    "toolResult": {
      "type": "object",
      "additionalProperties": false,
      "required": [
        "call_id",
        "output",
        "output_sha256"
      ],
      "properties": {
        "call_id": {
          "type": "string"
        },
        "output": {
          "type": "string"
        },
        "output_sha256": {
          "type": "string"
        }
      }
    },
    "imageAttachment": {
      "type": "object",
      "additionalProperties": false,
      "required": [
        "position",
        "media_type",
        "byte_size",
        "sha256"
      ],
      "properties": {
        "position": {
          "type": "integer",
          "minimum": 0,
          "maximum": 4294967295
        },
        "media_type": {
          "enum": [
            "image/png",
            "image/jpeg",
            "image/webp",
            "image/gif"
          ]
        },
        "byte_size": {
          "type": "integer",
          "minimum": 0
        },
        "sha256": {
          "type": "string"
        },
        "content_base64": {
          "type": "string",
          "contentEncoding": "base64"
        }
      }
    },
    "rawBody": {
      "type": "object",
      "additionalProperties": false,
      "required": [
        "transport",
        "parts"
      ],
      "properties": {
        "transport": {
          "enum": [
            "http",
            "websocket"
          ]
        },
        "parts": {
          "type": "array",
          "items": {
            "$ref": "#/$defs/rawBodyPart"
          }
        }
      }
    },
    "rawBodyPart": {
      "type": "object",
      "additionalProperties": false,
      "required": [
        "content_base64",
        "byte_size",
        "sha256",
        "truncated"
      ],
      "properties": {
        "content_base64": {
          "type": "string",
          "contentEncoding": "base64"
        },
        "byte_size": {
          "type": "integer",
          "minimum": 0
        },
        "sha256": {
          "type": "string",
          "pattern": "^[0-9a-f]{64}$"
        },
        "truncated": {
          "type": "boolean"
        },
        "content_type": {
          "type": "string"
        },
        "content_encoding": {
          "type": "string"
        },
        "sequence": {
          "type": "integer",
          "minimum": 0
        }
      }
    }
  }
}
