{
  "event_id": "evt-123",
  "occurred_at": "2026-08-19T10:00:00Z",
  "device": {
    "host_name": "developer-mac",
    "platform": "macos",
    "os_version": "15.6"
  },
  "agent": {
    "name": "codex",
    "version": "1.2.3"
  },
  "session_id": "session-123",
  "turn_index": 1,
  "turn_id": "turn-123",
  "llm": {
    "provider": "openai",
    "model": "gpt-5"
  },
  "side": "response",
  "text": "I will inspect the repository.",
  "token_usage": {
    "input_tokens": 0,
    "output_tokens": 12,
    "cache_read_tokens": 0,
    "cache_write_tokens": 0,
    "reasoning_tokens": 4,
    "total_tokens": 12
  },
  "tool_calls": [
    {
      "call_id": "call-123",
      "name": "exec",
      "input": "pwd",
      "input_sha256": "0000000000000000000000000000000000000000000000000000000000000000"
    }
  ],
  "attachments": [
    {
      "position": 0,
      "media_type": "image/png",
      "byte_size": 8,
      "sha256": "0000000000000000000000000000000000000000000000000000000000000000",
      "content_base64": "iVBORw0KGgo="
    }
  ],
  "raw_body": {
    "transport": "http",
    "parts": [
      {
        "content_base64": "eyAib3V0cHV0X3RleHQiOiAiSSB3aWxsIGluc3BlY3QgdGhlIHJlcG9zaXRvcnkuIiwgInVua25vd25fZmllbGQiOiBbMSwgMV0gfQo=",
        "byte_size": 77,
        "sha256": "c94e053ebd0a36bb05445e8b83bd07a7f0336dce3fda9a13a30f2c4292df5a54",
        "truncated": false,
        "content_type": "application/json"
      }
    ]
  }
}
